{
  "$schema": "http://json-schema.org/draft-07/schema#",
  "$id": "https://vecura.io/schemas/node-definition.json",
  "title": "Node Definition Schema",
  "description": "JSON Schema for workflow builder node definitions",
  "type": "object",
  "required": [
    "type",
    "label",
    "category",
    "icon",
    "color",
    "defaultInputs",
    "defaultOutputs",
    "configSchema"
  ],
  "properties": {
    "type": {
      "type": "string",
      "description": "Unique identifier for the node type",
      "pattern": "^[a-z][a-z0-9-]*$"
    },
    "label": {
      "type": "string",
      "description": "Human-readable label for the node"
    },
    "category": {
      "type": "string",
      "description": "Category for organizing nodes in the UI"
    },
    "icon": {
      "type": "string",
      "description": "Icon key from constants"
    },
    "color": {
      "type": "string",
      "description": "Color key from constants"
    },
    "description": {
      "type": "string",
      "description": "Optional description of the node's purpose"
    },
    "outputMockLabel": {
      "type": "string",
      "description": "Optional: mock label for output count display (e.g., '24 items', '20 compounds')"
    },
    "outputPageSize": {
      "type": "integer",
      "description": "Number of items per page in output table display (default: 10)",
      "minimum": 1
    },
    "defaultInputs": {
      "type": "array",
      "description": "Default input ports for the node",
      "items": {
        "$ref": "#/definitions/NodeIO"
      }
    },
    "defaultOutputs": {
      "type": "array",
      "description": "Default output ports for the node",
      "items": {
        "$ref": "#/definitions/NodeIO"
      }
    },
    "configSchema": {
      "type": "array",
      "description": "Configuration fields schema",
      "items": {
        "$ref": "#/definitions/ConfigField"
      }
    },
    "outputStandardTypes": {
      "type": "array",
      "description": "List of backend standard_type values this node produces (e.g. ['compound_list', 'target_list']). Used to filter compatible nodes in the Input Source selector UI.",
      "items": {
        "type": "string"
      }
    },
    "defaultConfig": {
      "type": "object",
      "description": "Optional: Default configuration values. Prefer using 'defaultValue' in configSchema fields instead."
    },
    "pricing": {
      "type": "object",
      "description": "Pricing information for the tool execution",
      "required": ["credits", "executionTime"],
      "properties": {
        "credits": {
          "type": "integer",
          "description": "Cost in credits per execution",
          "minimum": 0
        },
        "executionTime": {
          "type": "integer",
          "description": "Execution time units",
          "minimum": 1
        }
      }
    }
  },
  "definitions": {
    "NodeIO": {
      "type": "object",
      "required": ["id", "name", "type"],
      "properties": {
        "id": {
          "type": "string",
          "description": "Unique identifier for the I/O port"
        },
        "name": {
          "type": "string",
          "description": "Display name for the I/O port"
        },
        "type": {
          "type": "string",
          "enum": [
            "string",
            "number",
            "boolean",
            "object",
            "array",
            "structure",
            "image",
            "smiles"
          ],
          "description": "Data type of the I/O port"
        },
        "required": {
          "type": "boolean",
          "description": "Whether the input is required"
        },
        "description": {
          "type": "string",
          "description": "Description of the I/O port"
        },
        "tooltip": {
          "type": "string",
          "description": "Tooltip text to display on hover (supports markdown)"
        },
        "mappedFrom": {
          "type": "string",
          "description": "Reference to source node output (e.g., 'node1.output.data')"
        },
        "expectedStandardType": {
          "type": "string",
          "description": "Backend standard_type this input port expects (e.g. 'compound_list', 'target_list'). Used to filter compatible upstream nodes in the source selector UI."
        },
        "providedStandardType": {
          "type": "string",
          "description": "Backend standard_type this output port belongs to (e.g. 'compound_list'). Used to identify compatible source nodes."
        }
      }
    },
    "ConfigField": {
      "type": "object",
      "required": ["key", "type", "label"],
      "properties": {
        "key": {
          "type": "string",
          "description": "Configuration field key"
        },
        "type": {
          "oneOf": [
            {
              "type": "string",
              "enum": [
                "text",
                "number",
                "select",
                "multiselect",
                "boolean",
                "json",
                "textarea",
                "file",
                "markdown",
                "filter",
                "range",
                "pocket_selector",
                "structure_viewer"
              ]
            },
            {
              "type": "array",
              "items": {
                "type": "string",
                "enum": [
                  "text",
                  "number",
                  "select",
                  "multiselect",
                  "boolean",
                  "json",
                  "textarea",
                  "file",
                  "markdown",
                  "filter",
                  "range",
                  "pocket_selector",
                  "structure_viewer"
                ]
              },
              "minItems": 1
            }
          ],
          "description": "Type of configuration field. Can be a single type or array of types for multi-mode fields"
        },
        "label": {
          "type": "string",
          "description": "Display label for the field"
        },
        "placeholder": {
          "type": "string",
          "description": "Placeholder text for input fields"
        },
        "options": {
          "type": "array",
          "description": "Options for select and pocket_selector fields",
          "items": {
            "type": "object",
            "required": ["value", "label"],
            "properties": {
              "value": {
                "type": "string"
              },
              "label": {
                "type": "string"
              },
              "group": {
                "type": "string",
                "description": "Group name for grouping options (used by pocket_selector)"
              },
              "groupColor": {
                "type": "string",
                "description": "Color theme for the group (e.g., 'purple', 'teal')"
              },
              "filterValue": {
                "type": "string",
                "description": "Value used to filter data when this option is selected"
              }
            }
          }
        },
        "defaultValue": {
          "description": "Default value for the field"
        },
        "multiple": {
          "type": "boolean",
          "description": "For file inputs: allow multiple file selection"
        },
        "accept": {
          "type": "string",
          "description": "For file inputs: accepted file types (e.g., 'image/*', '.pdf,.doc')"
        },
        "description": {
          "type": "string",
          "description": "Description of the field."
        },
        "tooltip": {
          "type": "string",
          "description": "Tooltip text to display on hover (supports markdown)"
        },
        "showWhen": {
          "type": "array",
          "description": "Conditions for showing this field. All conditions must be satisfied (AND logic). Each condition's 'in' array uses OR logic. Use 'hasValue' to check if a field has any non-empty value.",
          "items": {
            "type": "object",
            "required": ["field"],
            "properties": {
              "field": {
                "type": "string",
                "description": "The key of the field to check"
              },
              "in": {
                "type": "array",
                "description": "Array of values - field value must match one of these. Use this OR hasValue, not both.",
                "items": {
                  "type": "string"
                }
              },
              "hasValue": {
                "type": "boolean",
                "description": "If true, field is shown when the referenced field has any non-empty value. If false, field is shown when the referenced field is empty. Use this OR 'in', not both."
              }
            },
            "oneOf": [
              {
                "required": ["in"]
              },
              {
                "required": ["hasValue"]
              }
            ]
          }
        },
        "advanced": {
          "type": "boolean",
          "description": "If true, field will be grouped in collapsible 'Advanced Settings' section"
        },
        "color": {
          "type": "string",
          "description": "For markdown fields: color theme for the card container (e.g., 'info', 'success', 'warning', 'error', 'default')"
        },
        "rows": {
          "type": "integer",
          "description": "For textarea fields: number of visible rows (default: 4)",
          "minimum": 1
        },
        "min": {
          "type": "number",
          "description": "For range fields: minimum value allowed"
        },
        "max": {
          "type": "number",
          "description": "For range fields: maximum value allowed"
        },
        "step": {
          "type": "number",
          "description": "For range fields: step increment value"
        },
        "suggestedField": {
          "type": "array",
          "description": "Suggested output field IDs from upstream nodes that can be mapped to this field",
          "items": {
            "type": "string"
          }
        },
        "structureUrl": {
          "type": "string",
          "description": "For structure_viewer fields: path to PDB file relative to workflow-data public dir (e.g., 'data/docking/CDK20.pdb')"
        },
        "showBox": {
          "type": "boolean",
          "description": "For structure_viewer fields: whether to show interactive 3D box controls (default: false)"
        },
        "boxCenter": {
          "type": "array",
          "description": "For structure_viewer fields: default box center [x, y, z] in Angstroms",
          "items": { "type": "number" },
          "minItems": 3,
          "maxItems": 3
        },
        "boxSize": {
          "type": "array",
          "description": "For structure_viewer fields: default box size [x, y, z] in Angstroms",
          "items": { "type": "number" },
          "minItems": 3,
          "maxItems": 3
        }
      }
    }
  }
}
