{
  "type": "ingredient-search",
  "label": "Ingredient Search",
  "category": "search",
  "icon": "search",
  "color": "green",
  "description": "Search ingredients suitable for your applications",
  "pricing": {
    "credits": 500,
    "executionTime": 1
  },
  "defaultInputs": [],
  "defaultOutputs": [
    {
      "id": "ingredient_name",
      "name": "Ingredient Name",
      "type": "string",
      "tooltip": "Common or trade name of the ingredient (e.g. \"Hyaluronic Acid\", \"Niacinamide\", \"Retinol\")."
    },
    {
      "id": "INCI_name",
      "name": "INCI Name",
      "type": "string",
      "tooltip": "International Nomenclature of Cosmetic Ingredients (INCI) name used in cosmetic labeling."
    },
    {
      "id": "CAS_number",
      "name": "CAS Number",
      "type": "string",
      "tooltip": "Chemical Abstracts Service (CAS) registry number. May be \"N/A\" for complex mixtures."
    },
    {
      "id": "supplier_count",
      "name": "Supplier Count",
      "type": "number",
      "tooltip": "Number of available suppliers for this ingredient in the database."
    },
    {
      "id": "Source",
      "name": "Source",
      "type": "string",
      "tooltip": "Natural or synthetic source of the ingredient (e.g. microbial fermentation, plant extract)."
    }
  ],
  "configSchema": [
    {
      "key": "query",
      "type": "textarea",
      "label": "Search Ingredient",
      "placeholder": "Search by ingredient function, application, or INCI name",
      "defaultValue": "",
      "tooltip": "Enter search terms to find ingredients. You can search by:\n- **Function**: e.g., \"moisturizing\", \"anti-aging\"\n- **Application**: e.g., \"hair care\", \"scalp care\"\n- **INCI name**: e.g., \"Niacinamide\", \"Sodium Hyaluronate\""
    }
  ],
  "defaultConfig": {
    "query": ""
  }
}
