{
  "type": "candidate-library",
  "label": "Candidate Library",
  "category": "library",
  "icon": "book-open-text",
  "color": "blue",
  "description": "Retrieve drug-like candidate compounds from ChEMBL and DrugBank for kinase inhibitor screening against RPS6KB1.",
  "pricing": {
    "credits": 800,
    "executionTime": 1
  },
  "outputMockLabel": "40 compounds",
  "defaultInputs": [
    {
      "id": "search_keyword",
      "name": "Search Keyword",
      "type": "string",
      "required": true,
      "tooltip": "Short text that anchors the search (e.g. \"natural flavonoids\", \"peptides\")."
    },
    {
      "id": "biological_effects",
      "name": "Biological Effects",
      "type": "string",
      "required": true,
      "tooltip": "Comma\u2011separated desired effects (e.g. \"antioxidant, anti-inflammatory\")."
    },
    {
      "id": "target_proteins",
      "name": "Target Protein(s)",
      "type": "string",
      "required": false,
      "tooltip": "Optional list of protein targets to focus the search (e.g. GSK3B, PDE1A)."
    },
    {
      "id": "scientific_description",
      "name": "Scientific Description",
      "type": "string",
      "required": false,
      "tooltip": "Free\u2011text background or hypotheses the library should reflect."
    }
  ],
  "defaultOutputs": [
    {
      "id": "vecurate_id",
      "name": "Vecurate id",
      "type": "string",
      "tooltip": "Vecurate internal compound identifier."
    },
    {
      "id": "smiles",
      "name": "SMILES",
      "type": "string",
      "tooltip": "SMILES string representing the chemical structure."
    }
  ],
  "configSchema": [
    {
      "key": "library_sources",
      "type": "multiselect",
      "label": "Primary Sources",
      "options": [
        {
          "value": "vecurate",
          "label": "Vecurate"
        },
        {
          "value": "vecurate_excerpt",
          "label": "Vecurate Excerpt (25 compounds)"
        },
        {
          "value": "bitterdb",
          "label": "BitterDB"
        },
        {
          "value": "super_sweet_db",
          "label": "SuperSweetDB"
        },
        {
          "value": "foo_db",
          "label": "FooDB"
        },
        {
          "value": "eu_cosing",
          "label": "EU CoSing"
        },
        {
          "value": "pubchem",
          "label": "PubChem"
        },
        {
          "value": "chembl",
          "label": "ChEMBL"
        },
        {
          "value": "drugbank",
          "label": "DrugBank"
        },
        {
          "value": "drugs_com",
          "label": "Drugs.com"
        },
        {
          "value": "fda",
          "label": "FDA"
        },
        {
          "value": "nih",
          "label": "NIH"
        },
        {
          "value": "unii",
          "label": "UNII"
        },
        {
          "value": "chemspider",
          "label": "ChemSpider"
        },
        {
          "value": "cas",
          "label": "CAS"
        }
      ],
      "tooltip": "Choose one or more databases to pull candidate structures from.",
      "defaultValue": [
        "vecurate"
      ]
    },
    {
      "key": "ingredientListFile",
      "type": "file",
      "label": "Or upload Compound List",
      "accept": ".pdf,.doc,.docx,.txt,.csv",
      "tooltip": "Upload your own compound list; parsed names/SMILES will be merged into the library."
    }
  ]
}