{
  "type": "product-search",
  "label": "Product Search",
  "category": "search",
  "icon": "search",
  "color": "amber",
  "description": "Search for beauty and personal care products",
  "pricing": {
    "credits": 500,
    "executionTime": 1
  },
  "outputMockLabel": "8 items",
  "defaultInputs": [],
  "defaultOutputs": [
    {
      "id": "Brand",
      "name": "Brand",
      "type": "string",
      "tooltip": "Brand name of the product (e.g. \"La Roche-Posay\", \"The Ordinary\", \"CeraVe\")."
    },
    {
      "id": "Product",
      "name": "Product",
      "type": "string",
      "tooltip": "Product name or title."
    },
    {
      "id": "Ingredients",
      "name": "Ingredients",
      "type": "string",
      "tooltip": "Comma-separated list of key ingredients in the product formulation."
    },
    {
      "id": "Description",
      "name": "Description",
      "type": "string",
      "tooltip": "Product description explaining its purpose, benefits, and usage."
    },
    {
      "id": "URL",
      "name": "URL",
      "type": "string",
      "tooltip": "Product page URL link."
    },
    {
      "id": "Price_usd",
      "name": "Price (USD)",
      "type": "number",
      "tooltip": "Product price in US dollars."
    },
    {
      "id": "Size",
      "name": "Size",
      "type": "string",
      "tooltip": "Product size or volume (e.g. \"30 mL\", \"50 g\")."
    },
    {
      "id": "format",
      "name": "Format",
      "type": "string",
      "tooltip": "Product format or delivery method (e.g. \"serum\", \"cream\", \"toner\")."
    },
    {
      "id": "rating",
      "name": "Rating",
      "type": "number",
      "tooltip": "Product rating score (typically on a scale of 1-5)."
    },
    {
      "id": "review_count",
      "name": "Review Count",
      "type": "number",
      "tooltip": "Total number of customer reviews for the product."
    },
    {
      "id": "image_url",
      "name": "Product Image",
      "type": "image",
      "tooltip": "Product image URL."
    }
  ],
  "configSchema": [
    {
      "key": "query",
      "type": "text",
      "label": "Search Query",
      "placeholder": "Enter product name, compounds, effects, or other search terms...",
      "tooltip": "Text search query for beauty products. You can search by product name, key compounds, desired effects, or other product attributes."
    },
    {
      "key": "region",
      "type": "select",
      "label": "Region",
      "options": [
        { "value": "global", "label": "Global" },
        { "value": "north_america", "label": "North America" },
        { "value": "south_america", "label": "South America" },
        { "value": "europe", "label": "Europe" },
        { "value": "asia", "label": "Asia" },
        { "value": "africa", "label": "Africa" },
        { "value": "oceania", "label": "Oceania" }
      ],
      "defaultValue": "global",
      "tooltip": "Select the continent/region to filter product search results."
    }
  ],
  "defaultConfig": {
    "query": "",
    "region": "global"
  }
}
