{
  "type": "target-mapping",
  "label": "Target Mapping",
  "category": "analysis",
  "icon": "target-icon",
  "color": "blue",
  "description": "Maps protein names or biological descriptions to assay metrics. Supports manual free-text input or automated lookup.",
  "pricing": {
    "credits": 800,
    "executionTime": 1
  },
  "outputMockLabel": "12 targets",
  "defaultInputs": [
    {
      "id": "target-input",
      "name": "Target/Protein Input",
      "type": "string",
      "required": false,
      "tooltip": "Optional input port carrying protein names or biological descriptions from previous steps."
    }
  ],
  "defaultOutputs": [
    {
      "id": "target",
      "name": "Target",
      "type": "string",
      "tooltip": "Protein target name or biological process (e.g. \"KATP\", \"GSK3β\", \"Safety assays\", \"Hair follicle biology\")."
    },
    {
      "id": "why_relevant",
      "name": "Why Relevant",
      "type": "string",
      "tooltip": "Biological rationale explaining why this target is relevant to the intended effect (e.g. \"DP anagen entry trigger\", \"Wnt inhibition release\")."
    },
    {
      "id": "desired_modulation",
      "name": "Desired Modulation",
      "type": "string",
      "tooltip": "Required modulation type: \"activation\" or \"inhibition\" for protein targets, or \"N/A\" for non-protein assays (e.g. safety, biology, stability)."
    },
    {
      "id": "assay_type",
      "name": "Assay Type",
      "type": "string",
      "tooltip": "Specific assay method used to measure the target or biological effect (e.g. \"patch clamp\", \"kinase ATP assay\", \"Dermal Papilla Cell Viability (MTT 72h)\")."
    },
    {
      "id": "metric",
      "name": "Metric",
      "type": "string",
      "tooltip": "Measurement unit or metric for the assay result (e.g. \"EC50\", \"IC50\", \"% viability\", \"mm\", \"MIC (µg/mL)\")."
    }
  ],
  "configSchema": [
    {
      "key": "query",
      "type": "textarea",
      "label": "Target Input",
      "placeholder": "Enter target name or biological effect (e.g., GSK3B, hair growth trigger...)",
      "tooltip": "Use this when you want to type a target or biological effect manually instead of wiring it from another node."
    },
    {
      "key": "max_results",
      "type": "number",
      "label": "Max results",
      "placeholder": "10 (default)",
      "tooltip": "Maximum number of results to return."
    }
  ],
  "defaultConfig": {
    "manualFreetext": "",
    "mappingTable": [
      {
        "target": "KATP",
        "relevance": "DP anagen entry trigger",
        "modulation": "activation",
        "assay": "patch clamp",
        "metric": "EC50"
      },
      {
        "target": "GSK3β",
        "relevance": "Wnt inhibition release",
        "modulation": "inhibition",
        "assay": "kinase ATP assay",
        "metric": "IC50"
      },
      {
        "target": "PDE1A",
        "relevance": "↑cAMP follicular signaling",
        "modulation": "inhibition",
        "assay": "cAMP hydrolysis assay",
        "metric": "IC50"
      },
      {
        "target": "TGFBR1",
        "relevance": "block catagen transition",
        "modulation": "inhibition",
        "assay": "Smad phosphorylation",
        "metric": "IC50"
      },
      {
        "target": "Safety assays",
        "relevance": "Cytotoxicity & viability",
        "modulation": "N/A",
        "assay": "Dermal Papilla Cell Viability (MTT 72h)",
        "metric": "% viability"
      },
      {
        "target": "Hair follicle biology",
        "relevance": "Ex vivo Hair Shaft Growth",
        "modulation": "N/A",
        "assay": "microdissected follicles 10 days",
        "metric": "mm"
      },
      {
        "target": "Inflammation",
        "relevance": "IL-8 Suppression",
        "modulation": "N/A",
        "assay": "ELISA / Reporter Assay",
        "metric": "% reduction"
      },
      {
        "target": "Oxidative stress",
        "relevance": "ROS Reduction",
        "modulation": "N/A",
        "assay": "DCFDA assay H2O2 challenge",
        "metric": "% ROS inhibition"
      },
      {
        "target": "Antimicrobial efficacy",
        "relevance": "MIC vs Malassezia restricta",
        "modulation": "N/A",
        "assay": "In vitro culture",
        "metric": "MIC (µg/mL)"
      },
      {
        "target": "Skin penetration",
        "relevance": "Franz Diffusion Model",
        "modulation": "N/A",
        "assay": "Franz cell",
        "metric": "cumulative permeation in µg/cm²/24h"
      },
      {
        "target": "Stability",
        "relevance": "4-week accelerated stability",
        "modulation": "N/A",
        "assay": "40°C/75%RH",
        "metric": "% active remaining"
      },
      {
        "target": "Gene expression",
        "relevance": "WNT/β-catenin Gene Panel",
        "modulation": "N/A",
        "assay": "qPCR in DP cells",
        "metric": "fold change vs untreated"
      }
    ]
  }
}
