{
  "type": "target-mapping",
  "label": "Target Mapping",
  "category": "analysis",
  "icon": "target-icon",
  "color": "blue",
  "description": "Maps protein targets to biological systems, assays, and metrics for sweet taste receptor research.",
  "pricing": {
    "credits": 800,
    "executionTime": 1
  },
  "outputMockLabel": "1 target",
  "defaultInputs": [
    {
      "id": "target-input",
      "name": "Target/Protein Input",
      "type": "string",
      "required": false,
      "tooltip": "Optional input port carrying protein names or biological descriptions from previous steps."
    }
  ],
  "defaultOutputs": [
    {
      "id": "protein_target",
      "name": "Protein Target",
      "type": "string",
      "tooltip": "Protein target name (e.g. \"TAS1R2\", \"TAS1R3\")."
    },
    {
      "id": "biological_system",
      "name": "Biological System",
      "type": "string",
      "tooltip": "Description of the biological system and expression context (e.g. \"Human sweet taste receptor (GPCR), heterodimerized with TAS1R3...\")."
    },
    {
      "id": "desired_modulation",
      "name": "Desired Modulation",
      "type": "string",
      "tooltip": "Required modulation type (e.g. \"Agonism or partial agonism\", \"Positive modulation / co-agonism\")."
    },
    {
      "id": "corresponding_assay",
      "name": "Corresponding Assay",
      "type": "string",
      "tooltip": "Specific assay method used to measure the target activity (e.g. \"Cell-based calcium flux assay\")."
    },
    {
      "id": "metric_used",
      "name": "Metric Used",
      "type": "string",
      "tooltip": "Measurement unit or metric for the assay result (e.g. \"EC₅₀, Emax\", \"EC₅₀ shift, Emax modulation\")."
    },
    {
      "id": "rationale",
      "name": "Rationale",
      "type": "string",
      "tooltip": "Scientific rationale explaining target relevance to sweet taste perception."
    },
    {
      "id": "crystallized_structure",
      "name": "Crystallized Structure Available?",
      "type": "string",
      "tooltip": "Indicates if a crystallized structure is available with PDB IDs (e.g. \"Yes (PDB: 9NOW, 9NOS..)\")."
    },
    {
      "id": "chembl_id",
      "name": "ChEMBL ID",
      "type": "string",
      "tooltip": "ChEMBL database identifier for the target (e.g. \"CHEMBL2363059\")."
    },
    {
      "id": "pdb_1",
      "name": "PDBs",
      "type": "structure",
      "tooltip": "- 9NOU: Human sweet taste receptor (TAS1R2 + TAS1R3) VFT domains from the combined datasets\n\n9NOR: Human sweet taste receptor composed of TAS1R2 and TAS1R3 GPCRs from the combined datasets"
    },
    {
      "id": "pdb_2",
      "name": "",
      "type": "structure",
      "tooltip": "URL to the second PDB structure file."
    }
  ],
  "configSchema": [
    {
      "key": "manualFreetext",
      "type": "textarea",
      "label": "Target Input",
      "placeholder": "Enter target name or biological effect (e.g., TAS1R2, sweet taste receptor...)",
      "tooltip": "Use this when you want to type a target or biological effect manually instead of wiring it from another node."
    }
  ],
  "defaultConfig": {
    "manualFreetext": "",
    "mappingTable": [
      {
        "protein_target": "TAS1R2 – TAS1R3 heterodimer (VFT domain)",
        "biological_system": "Human sweet taste receptor (Class C GPCR heterodimer) expressed in taste receptor cells and heterologous systems (e.g., HEK293)",
        "desired_modulation": "Agonism, partial agonism, or modulation of sweet perception",
        "corresponding_assay": "Cell-based calcium flux assay (co-expression of TAS1R2/TAS1R3 with Gα16, Gαgustducin, or chimeric G proteins); optional IP₃ or cAMP reporter assays",
        "metric_used": "EC₅₀, Emax, response shift vs reference sweetener",
        "rationale": "TAS1R2 provides the primary orthosteric binding site for most sweet ligands within the VFT domain, while TAS1R3 functions as an obligate co-receptor enabling receptor assembly, conformational signaling, and stabilization of the active state; effective sweet taste signaling requires the intact heterodimer",
        "crystallized_structure": "Yes (VFT-domain structures of the heterodimer available; e.g., PDB 9NOW, 9NOS)",
        "chembl_id": "CHEMBL2363059 (TAS1R2), CHEMBL2363060 (TAS1R3)",
        "pdb_1": "https://workflow-data-2sa8.vercel.app/data/docking/9NOU.pdb",
        "pdb_2": "https://workflow-data-2sa8.vercel.app/data/docking/9NOR.pdb"
      }
    ]
  }
}
